<?xml version="1.0"?>
<!DOCTYPE binary_file_format SYSTEM "BinaryFileFormat.dtd">
<binary_file_format name="SWF_Macromedia_Flash_File_Format" web_site="http://www.openswf.org/spec.html" type_name="" comment="Macromedia Flash File Format (SWF)" default_byte_order="little" default_read_only="true" default_char_set="ansi">
	<struct name="hdr" type_name="SWF File Header" comment="All SWF files begin with this header"><data type="string" name="Signature" format="ascii" len="3" domain="this == &quot;FWS&quot;" display="" comment="Magic characters that identify a .SWF file."/><data type="int" name="Version" format="unsigned" len="1" read_only="false" display="" comment="File version $04 fro SWF 4"/><data type="int" name="FileLength" format="unsigned" len="4" display="" comment="Length of entire file in bytes" units="bytes"/><struct name="FrameSize" type_name="RECT" comment="Frame size in TWIPS"><data type="int" name="NBits_5" format="unsigned" len="1" display="" comment="High five bites is number of bits of each of next 4 fields (Xmin, Xmax, Ymin, Ymax)"/><data type="none" name="REST" len="((NBits_5&gt;&gt;3)*4+5-1)/8" comment="This and lower 3 bits of previous byte encodes the 4 coords of the RECT"/></struct><data type="int" name="FrameRate1" format="unsigned" len="1" display="" units="frame/sec" comment="Frame delay (seconds part)"/><data type="int" name="FrameRate2" format="unsigned" len="1" display="" comment="Frame rate (fraction part)"/><data type="int" name="FrameCount" format="unsigned" len="2" display="" comment="Total number of frames in movie"/></struct><for name="tag" count="" stop_test="" type_name="" comment=""><struct name="" type_name="" comment=""><data type="int" name="Code" format="unsigned" len="2" display="" comment="Top 10 bits is the tag for the record type.  Bottom 6 bits is the tag length.  If bottom 6 bits is 63 (all bits on) then the real length is in following DWORD."/><if test="(Code &amp; 0x3F) &lt; 0x3F" comment="Short tag (length less than 63)"><data type="none" name="TagData_short" len="Code &amp; 0x3F" comment="The data for the short tag"/></if><if test="(Code &amp; 0x3F) == 0x3F" comment="Long tag (length &gt;= 63)"><struct name="LongTag" type_name="" comment="Length of long tag folllowed by the data"><data type="int" name="Length" format="unsigned" len="4" display="" comment="Length of long tag if short tag length is $3F"/><data type="none" name="TagData" len="Length" comment="Long tag data"/></struct></if></struct></for></binary_file_format>
