<?xml version="1.0"?>
<!DOCTYPE binary_file_format SYSTEM "BinaryFileFormat.dtd">
<binary_file_format name="HexEdit_Macro_File" type_name="" comment="">
	<struct name="header" type_name="" comment=""><data type="int" name="magic" format="unsigned" len="2" domain="this == 0xCDAB" display="hex" comment="&quot;magic&quot; number that always has this value for HexEdit macro files"/><data type="int" name="header_len" format="unsigned" len="2" display="" comment="Length of header (not including the previous field and this length field)"/><data type="int" name="plays" format="unsigned" len="4" display="" comment="Number of times the macro is played if called from another macro."/><data type="none" name="unused" len="20"/><data type="int" name="halt_level" format="signed" len="2" display="" comment="Determines the level of erro-condition that will stop the macro" domain="{ WARNINGS, MINOR, MAJOR }"/><data type="string" name="comment" format="ascii" display="" comment="Describes the macro -- shown when the macro file is loaded."/><data type="int" name="marker" format="unsigned" len="1" domain="this == 0xCD &amp;&amp; addressof(this) == (header_len+3)" display="hex" comment="Last byte of the header (always contains 0xCD)."/></struct><for name="key" count="" stop_test="" type_name="" comment=""><struct name="" type_name="" comment=""><data type="int" name="key_id" format="unsigned" len="1" display="" domain="{ new=1, open, print_setup, exit, find_text, toolbar, replace_text, bar, prop, prop_file, prop_char, prop_dec, prop_float, prop_ibmfp, prop_checksum, prop_close, calc_dlg, calc_close, help, topics, tips, about, focus, mainsys, childsys, encrypt_alg, encrypt_password, prop_date, prop_crc, prop_stats, prop_digest, macro_message, macro_play, bookmarks_goto, calc=50, user, clear, clear_entry, equals, change_bits, change_base, endian, binop, unaryop, memget, memstore, memclear, memadd, memsubtract, close=101, save, saveas, print, preview, undo, redo, cut, copy, paste, del, copy_hex, copy_decimal, copy_binary, copy_cchar, copy_cstring, copy_cword, copy_cdword, copy_cqword, copy_cfloat, copy_cdouble, paste_ascii, paste_unicode, paste_ebcdic, sel_all, write_file, append_file, read_file, find_dlg, find_close, find_back, find_forw, find_sel, goto, ro_rw, ovr_ins, mark_pos, goto_mark, extendto_mark, swap_mark, highlight, aerial, autofit, font, inc_font, dec_font, addr, char_area, ebcdic, control, control2, graphic, oem, rowsize, group_by, offset, win_new, win_next, win_cmd, redraw, scroll_up, scroll_down, swap_areas, start_line, key, char, mouse, shift_mouse, hscroll, vscroll, address_tool, compare, inc8, inc16, inc32, inc64, dec8, dec16, dec32, dec64, flip16, flip32, flip64, u1, u2, go, markstore, markclear, markadd, marksubtract, markatstore, selstore, selatstore, selendstore, sellenstore, markget, markat, bookmark, bookmarkat, selget, selat, selend, sellen, eofget, invert, neg8, neg16, neg32, neg64, sel_line, convert, encrypt, append_same_file, undo_changes, hex_area, display_reset, area, charset, scheme, display_state, import_motorola, import_intel, import_text, op_binary, op_unary, checksum, address_hex, address_dec, bookmarks, bookmarks_add, find_next, bookmark_all, replace, replace_all, dffd_sync }"/><if test="!(key_id == 167 || key_id == 168 || key_id == 2 || key_id == 5 || key_id == 7 || key_id == 23 || key_id == 26 || key_id == 27 || key_id == 32 || key_id == 33 || key_id == 34 || key_id == 128 || key_id == 219 || key_id == 221 || key_id == 222 || key_id == 223 || key_id == 227 || key_id == 228 || key_id == 230)" comment=""><data type="int" name="data" format="signed" len="8" display=""/></if><if test="key_id == 2 || key_id == 5 || key_id == 7 || key_id == 23 || key_id == 26 || key_id == 27 || key_id == 32 || key_id == 33 || key_id == 34 || key_id == 128 || key_id == 219 || key_id == 221 || key_id == 222 || key_id == 223 || key_id == 227 || key_id == 228 || key_id == 230" comment=""><struct name="string" type_name="" comment=""><data type="int" name="length" format="unsigned" len="2" display=""/><data type="string" name="str" format="ascii" display="" len="length"/><data type="char" name="EOS" format="ascii" domain="this == 0" display=""/></struct></if><if test="key_id == 167 || key_id == 168" comment=""><struct name="mouse_sel" type_name="" comment=""><data type="int" name="X" format="signed" len="4" display=""/><data type="int" name="Y" format="signed" len="4" display=""/><data type="int" name="unused" format="signed" len="4" display=""/><data type="int" name="CY" format="signed" len="8" display=""/><data type="none" name="pad" len="4"/></struct></if><if test="key_id == 144" comment=""><struct name="font" type_name="" comment=""><data type="int" name="height" format="unsigned" len="4" display="" comment="Font height" type_name="lfHeight"/><data type="int" name="charset" format="unsigned" len="1" display="" type_name="lfCharSet"/><data type="int" name="strlen" format="unsigned" len="2" display=""/><data type="string" name="name" format="ascii" display="" len="length" type_name="lfFaceName"/><data type="char" name="EOS" format="ascii" domain="this == 0" display=""/></struct></if></struct></for></binary_file_format>
